{
  "$schema": "https://json-schema.org/draft/2020-12/schema",
  "$id": "https://ingest.profit-base.online/exchange/v1/schemas/stock-lot.schema.json",
  "title": "Stock lot",
  "description": "The member's stock, personal and shared, of one material at one location, quality and stolen state, summed across org-unit pools, with its split into personal stock and each pool. It has no row id.",
  "type": "object",
  "properties": {
    "key": {
      "type": "string",
      "minLength": 1,
      "maxLength": 128,
      "description": "Opaque identifier issued by the Basetool. Clients store and echo it, never parse it."
    },
    "material": {
      "$ref": "item-ref.schema.json"
    },
    "materialKind": {
      "$ref": "material-kind.schema.json"
    },
    "location": {
      "$ref": "location-ref.schema.json"
    },
    "quality": {
      "$ref": "quality.schema.json"
    },
    "stolen": {
      "type": "boolean"
    },
    "quantity": {
      "$ref": "quantity.schema.json"
    },
    "split": {
      "type": "object",
      "description": "How the lot splits into the member's personal stock and the member's own shared stock in each unit's pool, each in the lot's unit. A pool of a unit the member has left stays while they hold stock in it. Other members' shared stock is never counted. Shared stock outside any unit counts as personal, so personal plus the pools add up to quantity, up to the rounding of each amount.",
      "properties": {
        "personal": {
          "$ref": "quantity.schema.json"
        },
        "pools": {
          "type": "array",
          "maxItems": 1000,
          "items": {
            "type": "object",
            "properties": {
              "orgUnit": {
                "type": "object",
                "properties": {
                  "id": {
                    "type": "string",
                    "minLength": 1,
                    "maxLength": 128,
                    "description": "Opaque identifier issued by the Basetool. Clients store and echo it, never parse it."
                  }
                },
                "required": [
                  "id"
                ]
              },
              "quantity": {
                "$ref": "quantity.schema.json"
              }
            },
            "required": [
              "orgUnit",
              "quantity"
            ]
          }
        }
      },
      "required": [
        "personal",
        "pools"
      ]
    },
    "extensions": {
      "$ref": "extensions.schema.json"
    }
  },
  "required": [
    "key",
    "material",
    "location",
    "quality",
    "stolen",
    "quantity"
  ]
}
