{
  "key": "lot-2",
  "material": {
    "bt": "m-2",
    "name": "Medical Supplies"
  },
  "materialKind": {
    "type": "NO_REFINE",
    "commodity": true,
    "mineral": false,
    "harvestable": false,
    "raw": false,
    "refined": false,
    "buyable": true,
    "sellable": true
  },
  "location": {
    "name": "Area18",
    "uex": {
      "kind": "CITY",
      "id": 4
    }
  },
  "quality": 0,
  "stolen": true,
  "quantity": {
    "amount": 32,
    "unit": "SCU"
  }
}
