{
  "key": "lot-1",
  "material": {
    "bt": "c3b1e0c2-8a4e-4f64-9a51-2b9f5c7e0a11",
    "name": "Laranite"
  },
  "materialKind": {
    "type": "RAW",
    "commodity": true,
    "mineral": true,
    "harvestable": false,
    "raw": true,
    "refined": false,
    "buyable": false,
    "sellable": true
  },
  "location": {
    "name": "Area18",
    "uex": {
      "kind": "CITY",
      "id": 4
    }
  },
  "quality": 712,
  "stolen": false,
  "quantity": {
    "amount": 12.5,
    "unit": "SCU"
  },
  "split": {
    "personal": {
      "amount": 4.5,
      "unit": "SCU"
    },
    "pools": [
      {
        "orgUnit": {
          "id": "0c2f8a51-7d3e-4b9a-9f10-5a6b7c8d9e01"
        },
        "quantity": {
          "amount": 8,
          "unit": "SCU"
        }
      }
    ]
  }
}
